[
  {
    "id": "level-1",
    "name": "Ванара (Лесной житель)",
    "amount": 1000,
    "period": "month",
    "description": "Базовый уровень поддержки. Вы помогаете проекту двигаться вперед.",
    "rewards": ["Ежемесячные отчеты о ходе работ"]
  },
  {
    "id": "level-2",
    "name": "Риши (Мудрец)",
    "amount": 3000,
    "period": "month",
    "description": "Для тех, кто глубоко ценит академическую точность и филологический труд.",
    "rewards": [
      "Ежемесячные отчеты",
      "Доступ к закрытым черновикам перевода"
    ]
  },
  {
    "id": "level-3",
    "name": "Кшатрий (Воин духа)",
    "amount": 5000,
    "period": "month",
    "description": "Значительный вклад в завершение эпоса.",
    "rewards": [
      "Ежемесячные отчеты",
      "Доступ к закрытым черновикам",
      "Ваше имя в списке благодарностей на сайте"
    ]
  },
  {
    "id": "level-4",
    "name": "Раджа (Покровитель)",
    "amount": 10000,
    "period": "month",
    "description": "Меценатский уровень. Вы становитесь со-творцом русского издания Рамаяны.",
    "rewards": [
      "Все привилегии уровня Кшатрий",
      "Печатный экземпляр книги после выхода из печати"
    ]
  }
]
